instance_id,sentence
modified_WilliamShakespeareHamlet_p2805,"este derecho... Óyeme aparte. Elige entre los más prudentes de tus amigos,"
modified_WilliamShakespeareHamlet_p2806,aquellos que te parezca. Oigamos a entrambos y juzguen. Si por mí propio u
modified_WilliamShakespeareHamlet_p2807,"por mano ajena, resulto culpado: mi reino, mi corona, mi vida, cuanto puedo"
modified_WilliamShakespeareHamlet_p2808,"llamar mío, todo te lo daré para satisfacerte. Si no hay culpa en mí, deberé"
modified_WilliamShakespeareHamlet_p2809,"contar otra vez con tu obediencia, y unidos ambos, buscaremos los medios de"
modified_WilliamShakespeareHamlet_p2810,aliviar tu dolor.
modified_WilliamShakespeareHamlet_p2811,"Hágase lo que decís... Su arrebatada muerte, su obscuro"
modified_WilliamShakespeareHamlet_p2812,"funeral: sin trofeos, armas, ni escudos sobre el cadáver, ni debidos honores,"
modified_WilliamShakespeareHamlet_p2813,"ni decorosa pompa; todo, todo está clamando del cielo a la tierra por un"
modified_WilliamShakespeareHamlet_p2814,"examen, el más riguroso."
modified_WilliamShakespeareHamlet_p2815,"Tú le obtendrás, y la segur terrible de la justicia caerá sobre"
modified_WilliamShakespeareHamlet_p2816,el que fuere delincuente. Ven conmigo.
modified_WilliamShakespeareHamlet_p2817,Escena XIX
modified_WilliamShakespeareHamlet_p2818,"HORACIO, UN CRIADO"
modified_WilliamShakespeareHamlet_p2819,Sala en casa de HORACIO.
modified_WilliamShakespeareHamlet_p2820,¿Quiénes son los que me quieren hablar?
modified_WilliamShakespeareHamlet_p2821,"Unos marineros, que según dicen os traen cartas."
modified_WilliamShakespeareHamlet_p2822,Hazlos entrar. Yo no sé de que parte del mundo pueda nadie
modified_WilliamShakespeareHamlet_p2823,"escribirme, si ya no es Hamlet mi señor."
modified_WilliamShakespeareHamlet_p2824,Escena XX
modified_WilliamShakespeareHamlet_p2825,"HORACIO, DOS MARINEROS"
modified_WilliamShakespeareHamlet_p2826,Dios os guarde.
modified_WilliamShakespeareHamlet_p2827,Y a vosotros también.
modified_WilliamShakespeareHamlet_p2828,Así lo hará si es su voluntad. Estas cartas del
modified_WilliamShakespeareHamlet_p2829,"Embajador que se embarcó para Inglaterra vienen dirigidas a vos, si os"
modified_WilliamShakespeareHamlet_p2830,"llamáis Horacio, como nos han dicho."
modified_WilliamShakespeareHamlet_p2831,"Horacio: luego que hayas leído ésta, dirigirás esos hombres"
modified_WilliamShakespeareHamlet_p2832,al Rey para el cual les he dado una carta. Apenas llevábamos dos días de
modified_WilliamShakespeareHamlet_p2833,"navegación, cuando empezó a darnos caza un pirata muy bien armado."
modified_WilliamShakespeareHamlet_p2834,"Viendo que nuestro navío era poco velero, nos vimos precisados a apelar al"
modified_WilliamShakespeareHamlet_p2835,"valor. Llegamos al abordaje: yo salté el primero en la embarcación enemiga,"
modified_WilliamShakespeareHamlet_p2836,"que al mismo tiempo logró desaferrarse de la nuestra, y por consiguiente me"
modified_WilliamShakespeareHamlet_p2837,hallé solo y prisionero. Ellos se han portado conmigo como ladrones
modified_WilliamShakespeareHamlet_p2838,"compasivos; pero ya sabían lo que se hacían, y se lo he pagado muy bien."
modified_WilliamShakespeareHamlet_p2839,"Haz que el Rey reciba las cartas que le envío, y tú ven a verme con tanta"
modified_WilliamShakespeareHamlet_p2840,"diligencia, como si huyeras de la muerte. Tengo unas cuantas palabras que"
modified_WilliamShakespeareHamlet_p2841,decirte al oído que te dejarán atónito; bien que todas ellas no serán suficientes
modified_WilliamShakespeareHamlet_p2842,a expresar la importancia del caso. Esos buenos hombres te conducirán hasta
modified_WilliamShakespeareHamlet_p2843,aquí. Guillermo y Ricardo siguieron su camino a Inglaterra. Mucho tengo que
modified_WilliamShakespeareHamlet_p2844,"decirte de ellos. Adiós. Tuyo siempre, Hamlet. Vamos. Yo os introduciré"
modified_WilliamShakespeareHamlet_p2845,"para que presentéis esas cartas. Conviene hacerlo pronto, a fin de que me"
modified_WilliamShakespeareHamlet_p2846,llevéis después a donde queda el que os las entregó.
modified_WilliamShakespeareHamlet_p2847,Escena XXI
modified_WilliamShakespeareHamlet_p2848,"CLAUDIO, LAERTES"
modified_WilliamShakespeareHamlet_p2849,Gabinete del Rey.
modified_WilliamShakespeareHamlet_p2850,"Sin duda tu rectitud aprobará ya mi descargo, y me darás"
modified_WilliamShakespeareHamlet_p2851,"lugar en el corazón como a tu amigo; después que has oído, con pruebas"
modified_WilliamShakespeareHamlet_p2852,"evidentes, que el matador de tu noble padre, conspiraba contra mi vida."
modified_WilliamShakespeareHamlet_p2853,"Claramente se manifiesta... Pero, decidme ¿por qué no"
modified_WilliamShakespeareHamlet_p2854,"procedéis contra excesos tan graves y culpables? Cuando vuestra prudencia,"
modified_WilliamShakespeareHamlet_p2855,"vuestra grandeza, vuestra propia seguridad, todas las consideraciones juntas,"
modified_WilliamShakespeareHamlet_p2856,deberían excitaros tan particularmente a reprimirlos.
modified_WilliamShakespeareHamlet_p2857,"Por dos razones, que aunque tal vez las juzgarás débiles;"
modified_WilliamShakespeareHamlet_p2858,"para mí han sido muy poderosas. Una es, que la Reina su madre vive"
modified_WilliamShakespeareHamlet_p2859,"pendiente casi de sus miradas, y al mismo tiempo (sea desgracia o felicidad"
modified_WilliamShakespeareHamlet_p2860,"mía) tan estrechamente unió el amor mi vida y mi alma a la de mi esposa, que"
modified_WilliamShakespeareHamlet_p2861,"así como los astros no se mueven sino dentro de su propia esfera, así en mí no"
modified_WilliamShakespeareHamlet_p2862,hay movimiento alguno que no dependa de su voluntad. La otra razón por
modified_WilliamShakespeareHamlet_p2863,que no puedo proceder contra el agresor públicamente es el grande cariño que
modified_WilliamShakespeareHamlet_p2864,"le tiene el pueblo, el cual, como la fuente cuyas aguas mudan los troncos en"
modified_WilliamShakespeareHamlet_p2865,"piedras, bañando en su afecto las faltas del Príncipe, convierte en gracias"
modified_WilliamShakespeareHamlet_p2866,"todos sus yerros. Mis flechas no pueden con tal violencia dispararse, que"
modified_WilliamShakespeareHamlet_p2867,"resistan a huracán tan fuerte; y sin tocar el punto a que las dirija, se volverán"
modified_WilliamShakespeareHamlet_p2868,otra vez al arco.
modified_WilliamShakespeareHamlet_p2869,"Seguiré en todo vuestras ideas, y mucho más si disponéis"
modified_WilliamShakespeareHamlet_p2870,que yo sea el instrumento que las ejecute.
modified_WilliamShakespeareHamlet_p2871,Todo sucede bien... Desde que te fuiste se ha hablado mucho
modified_WilliamShakespeareHamlet_p2872,"de ti delante de Hamlet, por una habilidad en que dicen que sobresales. Las"
modified_WilliamShakespeareHamlet_p2873,demás que tienes no movieron tanto su envidia como ésta sola: que en mi
modified_WilliamShakespeareHamlet_p2874,opinión ocupa el último lugar.
modified_WilliamShakespeareHamlet_p2875,"¿Y qué habilidad es, señor?"
modified_WilliamShakespeareHamlet_p2876,No es más que un lazo en el sombrero de la juventud; pero
modified_WilliamShakespeareHamlet_p2877,"que la es muy necesario, puesto que así son propios de la juventud los"
modified_WilliamShakespeareHamlet_p2878,"adornos ligeros y alegres, como de la edad madura las ropas y pieles que se"
modified_WilliamShakespeareHamlet_p2879,"viste, por abrigo y decencia... Dos meses ha que estuvo aquí un caballero de"
modified_WilliamShakespeareHamlet_p2880,"Normandía... Yo conozco a los franceses muy bien, he militado contra ellos,"
modified_WilliamShakespeareHamlet_p2881,y son por cierto buenos jinetes; pero el galán de quien hablo era un prodigio
modified_WilliamShakespeareHamlet_p2882,"en esto. Parecía haber nacido sobre la silla, y hacía ejecutar al caballo tan"
modified_WilliamShakespeareHamlet_p2883,"admirables movimientos, como si él y su valiente bruto animaran un cuerpo"
modified_WilliamShakespeareHamlet_p2884,"sólo, y tanto excedió a mis ideas, que todas las formas y actitudes que yo"
modified_WilliamShakespeareHamlet_p2885,"pude imaginar, no negaron a lo que él hizo."
modified_WilliamShakespeareHamlet_p2886,¿Decís que era normando?
modified_WilliamShakespeareHamlet_p2887,"Sí, normando."
modified_WilliamShakespeareHamlet_p2888,"Ese es Lamond, sin duda."
modified_WilliamShakespeareHamlet_p2889,Él mismo.
modified_WilliamShakespeareHamlet_p2890,Le conozco bien y es la joya más precisa de su nación.
modified_WilliamShakespeareHamlet_p2891,"Pues éste hablando de ti públicamente, te llenaba de elogios"
modified_WilliamShakespeareHamlet_p2892,"por tu inteligencia y ejercicio en la esgrima, y la bondad de tu espada en la"
modified_WilliamShakespeareHamlet_p2893,"defensa y el ataque; tanto que dijo alguna vez, que sería un espectáculo"
modified_WilliamShakespeareHamlet_p2894,"admirable el verte lidiar con otro de igual mérito; si pudiera hallarse, puesto"
modified_WilliamShakespeareHamlet_p2895,"que según aseguraba él mismo, los más diestros de su nación carecían de"
modified_WilliamShakespeareHamlet_p2896,agilidad para las estocadas y los quites cuando tu esgrimías con ellos. Este
modified_WilliamShakespeareHamlet_p2897,"informe irritó la envidia de Hamlet, y en nada pensó desde entonces sino en"
modified_WilliamShakespeareHamlet_p2898,"solicitar con instancia tu pronto regreso, para batallar contigo. Fuera de esto..."
modified_WilliamShakespeareHamlet_p2899,"¿Y qué hay además de eso, señor?"
modified_WilliamShakespeareHamlet_p2900,"Laertes, ¿amaste a tu padre? O eres como las figuras de un"
modified_WilliamShakespeareHamlet_p2901,"lienzo, que tal vez aparentan tristeza en el semblante, cuando las falta un"
modified_WilliamShakespeareHamlet_p2902,corazón.
modified_WilliamShakespeareHamlet_p2903,¿Por qué lo preguntáis?
modified_WilliamShakespeareHamlet_p2904,No porque piense que no amabas a tu padre; sino porque sé
modified_WilliamShakespeareHamlet_p2905,"que el amor está sujeto al tiempo, y que el tiempo extingue su ardor y sus"
modified_WilliamShakespeareHamlet_p2906,centellas; según me lo hace ver la experiencia de los sucesos. Existe en medio
modified_WilliamShakespeareHamlet_p2907,"de la llama de amor una mecha o pábilo que la destruye al fin, nada"
modified_WilliamShakespeareHamlet_p2908,"permanece en un mismo grado de bondad constantemente, pues la salud"
modified_WilliamShakespeareHamlet_p2909,misma degenerando en plétora perece por su propio exceso. Cuanto nos
modified_WilliamShakespeareHamlet_p2910,proponemos hacer debería ejecutarse en el instante mismo en que lo
modified_WilliamShakespeareHamlet_p2911,"deseamos, porque la voluntad se altera fácilmente, se debilita y se entorpece,"
modified_WilliamShakespeareHamlet_p2912,"según las lenguas, las manos y los accidentes que se atraviesan; y entonces,"
modified_WilliamShakespeareHamlet_p2913,"aquel estéril deseo es semejante a un suspiro, que exhalando pródigo el"
modified_WilliamShakespeareHamlet_p2914,"aliento causa daño, en vez de dar alivio... Pero, toquemos en lo vivo de la"
modified_WilliamShakespeareHamlet_p2915,"herida. Hamlet vuelve. ¿Qué acción emprenderías tú para manifestar, más"
modified_WilliamShakespeareHamlet_p2916,"con las obras que con las palabras, que eres digno hijo de tu padre?"
modified_WilliamShakespeareHamlet_p2917,¿Qué haré? Le cortaré la cabeza en el templo mismo.
modified_WilliamShakespeareHamlet_p2918,Cierto que no debería un homicida hallar asilo en parte
modified_WilliamShakespeareHamlet_p2919,"alguna, ni reconocer límites una justa venganza; pero, buen Laertes, haz lo"
modified_WilliamShakespeareHamlet_p2920,que te diré. Permanece oculto en tu cuarto; cuando llegue Hamlet sabrá que tú
modified_WilliamShakespeareHamlet_p2921,has venido; yo le haré acompañar por algunos que alabando tu destreza den
modified_WilliamShakespeareHamlet_p2922,"un nuevo lustre a los elogios que hizo de ti el francés. Por último, llegaréis a"
modified_WilliamShakespeareHamlet_p2923,"veros; se harán apuestas en favor de uno y otro... Él, que es descuidado,"
modified_WilliamShakespeareHamlet_p2924,"generoso, incapaz de toda malicia, no reconocerá los floretes; de suerte que te"
modified_WilliamShakespeareHamlet_p2925,"será muy fácil, con poca sutileza que uses, elegir una espada sin botón, y en"
modified_WilliamShakespeareHamlet_p2926,cualquiera de las jugadas tomar satisfacción de la muerte de tu padre.
modified_WilliamShakespeareHamlet_p2927,"Así lo haré, y a ese fin quiero envenenar la espada con cierto"
modified_WilliamShakespeareHamlet_p2928,"ungüento que compré de un charlatán, de cualidad tan mortífera, que"
modified_WilliamShakespeareHamlet_p2929,"mojando un cuchillo en él, adonde quiera que haga sangre introduce la"
modified_WilliamShakespeareHamlet_p2930,"muerte; sin que haya emplasto eficaz que pueda evitarla, por más que se"
modified_WilliamShakespeareHamlet_p2931,componga de cuantos simples medicinales crecen debajo de la luna. Yo
modified_WilliamShakespeareHamlet_p2932,"bañaré la punta de mi espada en este veneno, para que apenas le toque,"
modified_WilliamShakespeareHamlet_p2933,muera.
modified_WilliamShakespeareHamlet_p2934,"Reflexionemos más sobre esto... Examinemos, qué ocasión,"
modified_WilliamShakespeareHamlet_p2935,"qué medios serán más oportunos a nuestro engaño; porque, si tal vez se"
modified_WilliamShakespeareHamlet_p2936,"malogra, y equivocada la ejecución se descubren los fines, valiera más no"
modified_WilliamShakespeareHamlet_p2937,"haberlo emprendido. Conviene, pues, que este proyecto vaya sostenido con"
modified_WilliamShakespeareHamlet_p2938,"otro segundo, capaz de asegurar el golpe, cuando por el primero no se"
modified_WilliamShakespeareHamlet_p2939,consiga. Espera... Déjame ver si... Haremos una apuesta solemne sobre
modified_WilliamShakespeareHamlet_p2940,"vuestra habilidad y... Sí, ya hallé el medio. Cuando con la agitación os sintáis"
modified_WilliamShakespeareHamlet_p2941,acalorados y sedientos (puesto que al fin deberá ser mayor la violencia del
modified_WilliamShakespeareHamlet_p2942,"combate) él pedirá de beber, y yo le tendré prevenida expresamente una copa,"
modified_WilliamShakespeareHamlet_p2943,"que al gustarla sólo; aunque haya podido librarse de tu espada ungida,"
modified_WilliamShakespeareHamlet_p2944,veremos cumplido nuestro deseo. Pero... Calla. ¿Qué ruido se escucha?
modified_WilliamShakespeareHamlet_p2945,Escena XXII
modified_WilliamShakespeareHamlet_p2946,"GERTRUDIS, CLAUDIO, LAERTES"
modified_WilliamShakespeareHamlet_p2947,"¿Qué ocurre de nuevo, amada Reina?"
modified_WilliamShakespeareHamlet_p2948,Una desgracia va siempre pisando las ropas de otra; tan
modified_WilliamShakespeareHamlet_p2949,inmediatas caminan. Laertes tu hermana acaba de ahogarse.
modified_WilliamShakespeareHamlet_p2950,¡Ahogada! ¿En dónde? ¡Cielos!
modified_WilliamShakespeareHamlet_p2951,Donde hallaréis un sauce que crece a las orillas de ese
modified_WilliamShakespeareHamlet_p2952,"arroyo, repitiendo en las ondas cristalinas la imagen de sus hojas pálidas. Allí"
modified_WilliamShakespeareHamlet_p2953,"se encaminó, ridículamente coronada de ranúnculos, ortigas, margaritas y"
modified_WilliamShakespeareHamlet_p2954,"luengas flores purpúreas, que entre los sencillos labradores se reconocen bajo"
modified_WilliamShakespeareHamlet_p2955,"una denominación grosera, y las modestas doncellas llaman, dedos de"
modified_WilliamShakespeareHamlet_p2956,"muerto. Llegada que fue, se quitó la guirnalda, y queriendo subir a"
modified_WilliamShakespeareHamlet_p2957,"suspenderla de los pendientes ramos; se troncha un vástago envidioso, y caen"
modified_WilliamShakespeareHamlet_p2958,"al torrente fatal, ella y todos sus adornos rústicos. Las ropas huecas y"
modified_WilliamShakespeareHamlet_p2959,"extendidas la llevaron un rato sobre las aguas, semejante a una sirena, y en"
modified_WilliamShakespeareHamlet_p2960,"tanto iba cantando pedazos de tonadas antiguas, como ignorante de su"
modified_WilliamShakespeareHamlet_p2961,"desgracia, o como criada y nacida en aquel elemento. Pero no era posible que"
modified_WilliamShakespeareHamlet_p2962,"así durarse por mucho espacio. Las vestiduras, pesadas ya con el agua que"
modified_WilliamShakespeareHamlet_p2963,"absorbían la arrebataron a la infeliz; interrumpiendo su canto dulcísimo, la"
modified_WilliamShakespeareHamlet_p2964,"muerte, llena de angustias."
modified_WilliamShakespeareHamlet_p2965,¿Qué en fin se ahogó? ¡Mísero!
modified_WilliamShakespeareHamlet_p2966,"Sí, se ahogó, se ahogó."
modified_WilliamShakespeareHamlet_p2967,"¡Desdichada Ofelia! Demasiada agua tienes ya, por eso"
modified_WilliamShakespeareHamlet_p2968,quisiera reprimir la de mis ojos... Bien que a pesar de todos nuestros
modified_WilliamShakespeareHamlet_p2969,"esfuerzos, imperiosa la naturaleza sigue su costumbre, por más que el valor"
modified_WilliamShakespeareHamlet_p2970,"se avergüence. Pero, luego que este llanto se vierta, nada quedará en mí de"
modified_WilliamShakespeareHamlet_p2971,femenil ni de cobarde... Adiós señores... Mis palabras de fuego arderían en
modified_WilliamShakespeareHamlet_p2972,"llamas, si no las apagasen estas lágrimas imprudentes."
modified_WilliamShakespeareHamlet_p2973,"Sigámosle, Gertrudis, que después de haberme costado tanto"
modified_WilliamShakespeareHamlet_p2974,"aplacar su cólera, temo ahora que esta desgracia no la irrite otra vez."
modified_WilliamShakespeareHamlet_p2975,Conviene seguirle.
modified_WilliamShakespeareHamlet_p2976,****
modified_WilliamShakespeareHamlet_p2977,Acto Quinto
modified_WilliamShakespeareHamlet_p2978,Escena I
modified_WilliamShakespeareHamlet_p2979,SEPULTURERO 1.º SEPULTURERO 2.º
modified_WilliamShakespeareHamlet_p2980,Cementerio contiguo a una iglesia.
modified_WilliamShakespeareHamlet_p2981,"¿Y es la que ha de sepultarse en tierra sagrada, la"
modified_WilliamShakespeareHamlet_p2982,que deliberadamente ha conspirado contra su propia salvación?
modified_WilliamShakespeareHamlet_p2983,"Dígote que sí, conque haz presto el hoyo. El juez"
modified_WilliamShakespeareHamlet_p2984,ha reconocido ya el cadáver y ha dispuesto que se la entierre en sagrado.
modified_WilliamShakespeareHamlet_p2985,Yo no entiendo cómo va eso... Aun si se hubiera
modified_WilliamShakespeareHamlet_p2986,"ahogado haciendo esfuerzos para librarse, anda con Dios."
modified_WilliamShakespeareHamlet_p2987,Así han juzgado que fue.
modified_WilliamShakespeareHamlet_p2988,"No, no, eso fue se offendendo; ni puede haber sido"
modified_WilliamShakespeareHamlet_p2989,de otra manera: porque... Ve aquí el punto de la dificultad. Si yo me ahogo
modified_WilliamShakespeareHamlet_p2990,"voluntariamente, esto arguye por de contado una acción, y toda acción consta"
modified_WilliamShakespeareHamlet_p2991,"de tres partes, que son: hacer, obrar y ejecutar, de donde se infiere, amigo"
modified_WilliamShakespeareHamlet_p2992,"Rasura, que ella se ahogó voluntariamente."
modified_WilliamShakespeareHamlet_p2993,"¡Qué! Pero, oígame ahora el tío Socaba."
modified_WilliamShakespeareHamlet_p2994,"No, deja, yo te diré. Mira, aquí está el agua. Bien."
modified_WilliamShakespeareHamlet_p2995,"Aquí está un hombre. Muy bien... Pues señor, si este hombre va y se mete"
modified_WilliamShakespeareHamlet_p2996,"dentro del agua, se ahoga a sí mismo, porque, por fas o por nefas, ello es que"
modified_WilliamShakespeareHamlet_p2997,"él va... Pero, atiende a lo que digo. Si el agua viene hacia él y le sorprende y"
modified_WilliamShakespeareHamlet_p2998,"le ahoga, entonces no se ahoga él a sí propio... Compadre Rasura, el que no"
modified_WilliamShakespeareHamlet_p2999,"desea su muerte, no se acorta la vida."
modified_WilliamShakespeareHamlet_p3000,¿Y qué hay leyes para eso?
modified_WilliamShakespeareHamlet_p3001,"Ya se ve que las hay, y por ellas se guía el juez que"
modified_WilliamShakespeareHamlet_p3002,examina estos casos.
modified_WilliamShakespeareHamlet_p3003,"¿Quieres que te diga la verdad? Pues mira, si la"
modified_WilliamShakespeareHamlet_p3004,"muerta no fuese una señora, yo te aseguro que no la enterrarían en sagrado."
modified_WilliamShakespeareHamlet_p3005,En efecto dices bien y es mucha lástima que los
modified_WilliamShakespeareHamlet_p3006,"grandes personajes hayan de tener en este mundo especial privilegio, entre"
modified_WilliamShakespeareHamlet_p3007,"todos los demás cristianos, para ahogarse y ahorcarse cuando quieren, sin que"
modified_WilliamShakespeareHamlet_p3008,nadie les diga nada... Vamos allá con el azadón... Ello es que no hay
modified_WilliamShakespeareHamlet_p3009,"caballeros de nobleza más antigua que los jardineros, sepultureros y"
modified_WilliamShakespeareHamlet_p3010,"cavadores, que son los que ejercen la profesión de Adán."
modified_WilliamShakespeareHamlet_p3011,"Pues qué, ¿Adán fue caballero?"
modified_WilliamShakespeareHamlet_p3012,¡Toma! Como que fue el primero que llevó
modified_WilliamShakespeareHamlet_p3013,"armas... Pero, voy a hacerte una pregunta y si no me respondes a cuento, has"
modified_WilliamShakespeareHamlet_p3014,de confesar que eres un...
modified_WilliamShakespeareHamlet_p3015,Adelante.
modified_WilliamShakespeareHamlet_p3016,"¿Cuál es el que construye edificios más fuertes,"
modified_WilliamShakespeareHamlet_p3017,que los que hacen los albañiles y los carpinteros de casas y navíos?
modified_WilliamShakespeareHamlet_p3018,"El que hace la horca, porque aquella fábrica"
modified_WilliamShakespeareHamlet_p3019,sobrevive a mil inquilinos.
modified_WilliamShakespeareHamlet_p3020,"Agudo eres, por vida mía. Buen edificio es la"
modified_WilliamShakespeareHamlet_p3021,"horca; pero, ¿cómo es bueno? Es bueno para los que hacen mal; ahora bien,"
modified_WilliamShakespeareHamlet_p3022,"tú haces mal en decir que la horca es fábrica más fuerte que una iglesia, con"
modified_WilliamShakespeareHamlet_p3023,que la horca podría ser buena para ti... Volvamos a la pregunta.
modified_WilliamShakespeareHamlet_p3024,¿Cuál es el que hace habitaciones más durables
modified_WilliamShakespeareHamlet_p3025,"que las que hacen los albañiles, los carpinteros de casas y de navíos?"
modified_WilliamShakespeareHamlet_p3026,"Sí, dímelo y sales del apuro."
modified_WilliamShakespeareHamlet_p3027,Ya se ve que te lo diré.
modified_WilliamShakespeareHamlet_p3028,Pues vamos.
modified_WilliamShakespeareHamlet_p3029,Pues no puedo decirlo.
modified_WilliamShakespeareHamlet_p3030,"Vaya, no te rompas la cabeza sobre ello... Tú eres"
modified_WilliamShakespeareHamlet_p3031,"un burro lerdo, que no saldrá de su paso por más que le apaleen. Cuando te"
modified_WilliamShakespeareHamlet_p3032,"hagan esta pregunta, has de responder: el Sepulturero. ¿No ves que las casas"
modified_WilliamShakespeareHamlet_p3033,"que él hace, duran hasta el día del juicio? Anda, ve ahí a casa de Juanillo y"
modified_WilliamShakespeareHamlet_p3034,tráeme una copa de aguardiente.
modified_WilliamShakespeareHamlet_p3035,Escena II
modified_WilliamShakespeareHamlet_p3036,"HAMLET, HORACIO, SEPULTURERO 1.º"
modified_WilliamShakespeareHamlet_p3037,SEPULTURERO 1. Yo amé en mis primeros
modified_WilliamShakespeareHamlet_p3038,"años,"
modified_WilliamShakespeareHamlet_p3039,dulce cosa lo juzgué;
modified_WilliamShakespeareHamlet_p3040,"pero casarme, eso no,"
modified_WilliamShakespeareHamlet_p3041,que no me estuviera bien.
modified_WilliamShakespeareHamlet_p3042,"Qué poco siente ese hombre lo que hace, que abre una"
modified_WilliamShakespeareHamlet_p3043,sepultura y canta.
modified_WilliamShakespeareHamlet_p3044,La costumbre le ha hecho ya familiar esa ocupación.
modified_WilliamShakespeareHamlet_p3045,"Así es la verdad. La mano que menos trabaja, tiene más"
modified_WilliamShakespeareHamlet_p3046,delicado el tacto.
modified_WilliamShakespeareHamlet_p3047,"me hundió con mano cruel,"
modified_WilliamShakespeareHamlet_p3048,y toda se destruyó
modified_WilliamShakespeareHamlet_p3049,la existencia que gocé.
modified_WilliamShakespeareHamlet_p3050,"Aquella calavera tendría lengua en otro tiempo, y con ella"
modified_WilliamShakespeareHamlet_p3051,podría también cantar... ¡Cómo la tira al suelo el pícaro! Como si fuese la
modified_WilliamShakespeareHamlet_p3052,quijada con que hizo Caín el primer homicidio. Y la que está maltratando
modified_WilliamShakespeareHamlet_p3053,"ahora ese bruto, podría ser muy bien la cabeza de algún estadista, que acaso"
modified_WilliamShakespeareHamlet_p3054,pretendió engañar al Cielo mismo. ¿No te parece?
modified_WilliamShakespeareHamlet_p3055,Bien puede ser.
modified_WilliamShakespeareHamlet_p3056,"O la de algún cortesano, que diría: felicísimos días, Señor"
modified_WilliamShakespeareHamlet_p3057,"Excelentísimo, ¿cómo va de salud, mi venerado Señor? Ésta puede ser la del"
modified_WilliamShakespeareHamlet_p3058,"caballero Fulano, que hacía grandes elogios del potro del caballero Zutano,"
modified_WilliamShakespeareHamlet_p3059,para pedírsele prestado después. ¿No puede ser así?
modified_WilliamShakespeareHamlet_p3060,Sí señor.
modified_WilliamShakespeareHamlet_p3061,"¡Oh! Sí por cierto, y ahora está en poder del señor gusano,"
modified_WilliamShakespeareHamlet_p3062,estropeada y hecha pedazos con el azadón de un sepulturero... Grandes
modified_WilliamShakespeareHamlet_p3063,"revoluciones se hacen aquí, si hubiera en nosotros, medios para observarlas..."
modified_WilliamShakespeareHamlet_p3064,"Pero, ¿costó acaso tan poco la formación de estos huesos a la naturaleza, que"
modified_WilliamShakespeareHamlet_p3065,hayan de servir para que esa gente se divierta en sus garitos con ellos?... ¡Eh!
