instance_id,sentence
modified_WilliamShakespeareHamlet_p814,nacidos de la efervescencia general de la sangre.
modified_WilliamShakespeareHamlet_p815,"Pero, señor..."
modified_WilliamShakespeareHamlet_p816,"¡Ah! Tú querrás saber con qué fin debes hacer esto, ¿eh?"
modified_WilliamShakespeareHamlet_p817,Gustaría de saberlo.
modified_WilliamShakespeareHamlet_p818,"Pues, señor, mi fin es éste; y creo que es proceder con mucha"
modified_WilliamShakespeareHamlet_p819,cordura. Cargando esas pequeñas faltas sobre mi hijo (como ligeras manchas
modified_WilliamShakespeareHamlet_p820,de una obra preciosa) ganarás por medio de la conversación la confianza de
modified_WilliamShakespeareHamlet_p821,aquel a quien pretendas examinar. Si él está persuadido de que el muchacho
modified_WilliamShakespeareHamlet_p822,"tiene los mencionados vicios que tú le imputas, no dudes que él convenga con"
modified_WilliamShakespeareHamlet_p823,"tu opinión, diciendo: señor mío, o amigo, o caballero... En fin, según el título"
modified_WilliamShakespeareHamlet_p824,o dictado de la persona o del país.
modified_WilliamShakespeareHamlet_p825,"Sí, ya estoy."
modified_WilliamShakespeareHamlet_p826,Pues entonces él dice... Dice... ¿Qué iba yo a decir ahora?...
modified_WilliamShakespeareHamlet_p827,Algo iba yo a decir. ¿En qué estábamos?
modified_WilliamShakespeareHamlet_p828,En que él concluirá diciendo al amigo o al caballero.
modified_WilliamShakespeareHamlet_p829,"Sí, concluirá diciendo. Es verdad... (así te dirá precisamente)"
modified_WilliamShakespeareHamlet_p830,"algo iba yo a decir. Es verdad, yo conozco a ese mozo; ayer le vi o cualquier"
modified_WilliamShakespeareHamlet_p831,"otro día, o en tal y tal ocasión, con este o con aquel sujeto, y allí como habéis"
modified_WilliamShakespeareHamlet_p832,"dicho, le vi que jugaba, allá le encontré en una comilona, acullá en una"
modified_WilliamShakespeareHamlet_p833,"quimera sobre el juego de pelota y..., (puede ser que añada) le he visto entrar"
modified_WilliamShakespeareHamlet_p834,"en una casa pública, videlicet en un burdel, o cosa tal. ¿Lo entiendes ahora?"
modified_WilliamShakespeareHamlet_p835,Con el anzuelo de la mentira pescarás la verdad; que así es como nosotros los
modified_WilliamShakespeareHamlet_p836,"que tenemos talento y prudencia, solemos conseguir por indirectas el fin"
modified_WilliamShakespeareHamlet_p837,"directo, usando de artificios y disimulación. Así lo harás con mi hijo, según la"
modified_WilliamShakespeareHamlet_p838,instrucción y advertencia que acabo de darte. ¿Me has entendido?
modified_WilliamShakespeareHamlet_p839,"Sí, señor, quedo enterado."
modified_WilliamShakespeareHamlet_p840,"Pues, adiós; buen viaje."
modified_WilliamShakespeareHamlet_p841,Señor...
modified_WilliamShakespeareHamlet_p842,Examina por ti mismo sus inclinaciones.
modified_WilliamShakespeareHamlet_p843,Así lo haré.
modified_WilliamShakespeareHamlet_p844,Dejándole que obre libremente.
modified_WilliamShakespeareHamlet_p845,"Está bien, señor."
modified_WilliamShakespeareHamlet_p846,Adiós.
modified_WilliamShakespeareHamlet_p847,Escena II
modified_WilliamShakespeareHamlet_p848,POLONIO OFELIA
modified_WilliamShakespeareHamlet_p849,"Y bien, Ofelia, ¿qué hay de nuevo?"
modified_WilliamShakespeareHamlet_p850,"¡Ay! ¡Señor, que he tenido un susto muy grande!"
modified_WilliamShakespeareHamlet_p851,¿Con qué motivo? Por Dios que me lo digas.
modified_WilliamShakespeareHamlet_p852,"Yo estaba haciendo labor en mi cuarto, cuando el Príncipe"
modified_WilliamShakespeareHamlet_p853,"Hamlet, la ropa desceñida, sin sombrero en la cabeza, sucias las medias, sin"
modified_WilliamShakespeareHamlet_p854,"atar, caídas hasta los pies, pálido como su camisa, las piernas trémulas, el"
modified_WilliamShakespeareHamlet_p855,semblante triste como si hubiera salido del infierno para anunciar horror... Se
modified_WilliamShakespeareHamlet_p856,presenta delante de mí.
modified_WilliamShakespeareHamlet_p857,"Loco, sin duda, por tus amores, ¿eh?"
modified_WilliamShakespeareHamlet_p858,"Yo, señor, no lo sé; pero en verdad lo temo."
modified_WilliamShakespeareHamlet_p859,¿Y qué te dijo?
modified_WilliamShakespeareHamlet_p860,"Me asió una mano, y me la apretó fuertemente. Apartose"
modified_WilliamShakespeareHamlet_p861,"después a la distancia de su brazo, y poniendo, así, la otra mano sobre su"
modified_WilliamShakespeareHamlet_p862,"frente, fijó la vista en mi rostro recorriéndolo con atención como si hubiese"
modified_WilliamShakespeareHamlet_p863,"de retratarle. De este modo permaneció largo rato; hasta que por último,"
modified_WilliamShakespeareHamlet_p864,"sacudiéndome ligeramente el brazo, y moviendo tres veces la cabeza abajo y"
modified_WilliamShakespeareHamlet_p865,"arriba, exhaló un suspiro tan profundo y triste, que pareció deshacérsele en"
modified_WilliamShakespeareHamlet_p866,"pedazos el cuerpo, y dar fin a su vida. Hecho esto, me dejó, y levantada la"
modified_WilliamShakespeareHamlet_p867,"cabeza comenzó a andar, sin valerse de los ojos para hallar el camino; salió"
modified_WilliamShakespeareHamlet_p868,"de la puerta sin verla, y al pasar por ella, fijó la vista en mí."
modified_WilliamShakespeareHamlet_p869,"Ven conmigo, quiero ver al Rey. Ese es un verdadero éxtasis"
modified_WilliamShakespeareHamlet_p870,"de amor que siempre fatal a sí mismo, en su exceso violento, inclina la"
modified_WilliamShakespeareHamlet_p871,"voluntad a empresas temerarias, más que ninguna otra pasión de cuantas"
modified_WilliamShakespeareHamlet_p872,debajo del cielo combaten nuestra naturaleza. Mucho siento este accidente.
modified_WilliamShakespeareHamlet_p873,"Pero, dime, ¿le has tratado con dureza en estos últimos días?"
modified_WilliamShakespeareHamlet_p874,"No señor; sólo en cumplimiento de lo que mandasteis, le he"
modified_WilliamShakespeareHamlet_p875,"devuelto sus cartas, y me he negado a sus visitas."
modified_WilliamShakespeareHamlet_p876,Y eso basta para haberle trastornado así. Me pesa no haber
modified_WilliamShakespeareHamlet_p877,juzgado con más acierto su pasión. Yo temí que era sólo un artificio suyo
modified_WilliamShakespeareHamlet_p878,para perderte... ¡Sospecha indigna! ¡Eh! Tan propio parece de la edad anciana
modified_WilliamShakespeareHamlet_p879,"pasar más allá de lo justo en sus conjeturas, como lo es de la juventud la falta"
modified_WilliamShakespeareHamlet_p880,"de previsión. Vamos, vamos a ver al Rey. Conviene que lo sepa. Si le callo"
modified_WilliamShakespeareHamlet_p881,"este amor, sería más grande el sentimiento que pudiera causarle teniéndole"
modified_WilliamShakespeareHamlet_p882,"oculto, que el disgusto que recibirá al saberlo. Vamos."
modified_WilliamShakespeareHamlet_p883,Escena III
modified_WilliamShakespeareHamlet_p884,"CLAUDIO, GERTRUDIS, RICARDO, GUILLERMO, acompañamiento."
modified_WilliamShakespeareHamlet_p885,Salón de palacio.
modified_WilliamShakespeareHamlet_p886,"Bienvenido, Guillermo, y tú también querido Ricardo."
modified_WilliamShakespeareHamlet_p887,"Además de lo mucho que se me dilataba el veros, la necesidad que tengo de"
modified_WilliamShakespeareHamlet_p888,vosotros me ha determinado a solicitar vuestra venida. Algo habéis oído ya
modified_WilliamShakespeareHamlet_p889,"de la transformación de Hamlet. Así puedo llamarla, puesto que ni en lo"
modified_WilliamShakespeareHamlet_p890,"interior, ni en lo exterior se parece nada al que antes era; ni llego a imaginar"
modified_WilliamShakespeareHamlet_p891,"que otra causa haya podido privarle así de la razón, si ya no es la muerte de"
modified_WilliamShakespeareHamlet_p892,"su padre. Yo os ruego a entrambos, pues desde la primera infancia os habéis"
modified_WilliamShakespeareHamlet_p893,"criado con él, y existe entre vosotros aquella intimidad nacida de la igualdad"
modified_WilliamShakespeareHamlet_p894,"en los años y en el genio, que tengáis a bien deteneros en mi corte algunos"
modified_WilliamShakespeareHamlet_p895,"días. Acaso el trato vuestro restablecerá su alegría, y aprovechando las"
modified_WilliamShakespeareHamlet_p896,"ocasiones que se presenten, ved cual sea la ignorada aflicción que así le"
modified_WilliamShakespeareHamlet_p897,"consume para que descubriéndola, procuremos su alivio."
modified_WilliamShakespeareHamlet_p898,"Él ha hablado mucho de vosotros, mis buenos señores, y"
modified_WilliamShakespeareHamlet_p899,estoy segura de que no se hallaran otros dos sujetos a quienes él profese
modified_WilliamShakespeareHamlet_p900,mayor cariño. Si tanta fuese vuestra bondad que gustéis de pasar con nosotros
modified_WilliamShakespeareHamlet_p901,"algún tiempo, para contribuir al logro de mi esperanza; vuestra asistencia será"
modified_WilliamShakespeareHamlet_p902,"remunerada, como corresponde al agradecimiento de un Rey."
modified_WilliamShakespeareHamlet_p903,"Vuestras Majestades tienen soberana autoridad en nosotros,"
modified_WilliamShakespeareHamlet_p904,y en vez de rogar deben mandarnos.
modified_WilliamShakespeareHamlet_p905,"Uno y otro obedeceremos, y postramos a vuestros pies"
modified_WilliamShakespeareHamlet_p906,con el más puro afecto el celo de serviros que nos anima.
modified_WilliamShakespeareHamlet_p907,"Muchas gracias, cortés Guillermo. Gracias, Ricardo."
modified_WilliamShakespeareHamlet_p908,"Os quedo muy agradecida, señores, y os pido que veáis"
modified_WilliamShakespeareHamlet_p909,cuanto antes a mi doliente hijo. Conduzca alguno de vosotros a estos
modified_WilliamShakespeareHamlet_p910,"caballeros, a donde Hamlet se halle."
modified_WilliamShakespeareHamlet_p911,Haga el Cielo que nuestra compañía y nuestros conatos
modified_WilliamShakespeareHamlet_p912,puedan serle agradables y útiles.
modified_WilliamShakespeareHamlet_p913,"Sí, amén."
modified_WilliamShakespeareHamlet_p914,Escena IV
modified_WilliamShakespeareHamlet_p915,"CLAUDIO, GERTRUDIS, POLONIO, acompañamiento."
modified_WilliamShakespeareHamlet_p916,"Señor, los Embajadores enviados a Noruega, han vuelto ya,"
modified_WilliamShakespeareHamlet_p917,en extremo contentos.
modified_WilliamShakespeareHamlet_p918,Siempre has sido tú padre de buenas nuevas.
modified_WilliamShakespeareHamlet_p919,"¡Oh! Sí ¿No es verdad? Y os puedo asegurar, venerado"
modified_WilliamShakespeareHamlet_p920,"señor, que mis acciones y mi corazón no tienen otro objeto que el servicio de"
modified_WilliamShakespeareHamlet_p921,"Dios, y el de mi Rey; y si este talento mío no ha perdido enteramente aquel"
modified_WilliamShakespeareHamlet_p922,"seguro olfato con que supo siempre rastrear asuntos políticos, pienso haber"
modified_WilliamShakespeareHamlet_p923,descubierto ya la verdadera causa de la locura del Príncipe.
modified_WilliamShakespeareHamlet_p924,"Pues dínosla, que estoy impaciente de saberla."
modified_WilliamShakespeareHamlet_p925,Será bien que deis primero audiencia a los Embajadores; mi
modified_WilliamShakespeareHamlet_p926,informe servirá de postres a este gran festín.
modified_WilliamShakespeareHamlet_p927,Tú mismo puedes ir a cumplimentarlos e introducirlos. Dice
modified_WilliamShakespeareHamlet_p928,"que ha descubierto, amada Gertrudis, la causa verdadera de la indisposición"
modified_WilliamShakespeareHamlet_p929,de tu hijo.
modified_WilliamShakespeareHamlet_p930,¡Ah! Yo dudo que él tenga otra mayor que la muerte de su
modified_WilliamShakespeareHamlet_p931,"padre, y nuestro acelerado casamiento."
modified_WilliamShakespeareHamlet_p932,Yo sabré examinarle.
modified_WilliamShakespeareHamlet_p933,Escena V
modified_WilliamShakespeareHamlet_p934,"CLAUDIO, GERTRUDIS, POLONIO, VOLTIMAN, CORNELIO,"
modified_WilliamShakespeareHamlet_p935,acompañamiento.
modified_WilliamShakespeareHamlet_p936,"Bienvenidos, amigos. Dí, Voltiman, ¿qué respondió nuestro"
modified_WilliamShakespeareHamlet_p937,"hermano, el Rey de Noruega?"
modified_WilliamShakespeareHamlet_p938,Corresponde con la más sincera amistad a vuestras
modified_WilliamShakespeareHamlet_p939,"atenciones y a vuestro ruego. Así que llegamos, mandó suspender los"
modified_WilliamShakespeareHamlet_p940,"armamentos que hacía su sobrino, fingiendo ser preparativos contra el polaco;"
modified_WilliamShakespeareHamlet_p941,"pero mejor informado después, halló ser cierto que se dirigían en ofensa"
modified_WilliamShakespeareHamlet_p942,vuestra. Indignado de que abusaran así de la impotencia a que le han reducido
modified_WilliamShakespeareHamlet_p943,"su edad y sus males, envió estrechas órdenes a Fortimbrás, que sometiéndose"
modified_WilliamShakespeareHamlet_p944,"prontamente a las reprehensiones del tío, le ha jurado por último que nunca"
modified_WilliamShakespeareHamlet_p945,más tomará las armas contra Vuestra Majestad. Satisfecho de este
modified_WilliamShakespeareHamlet_p946,"procedimiento el anciano Rey, le señala sesenta mil escudos anuales, y le"
modified_WilliamShakespeareHamlet_p947,permite emplear contra Polonia las tropas que había levantado. A este fin os
modified_WilliamShakespeareHamlet_p948,ruega concedáis paso libre por vuestros estados al ejército prevenido para tal
modified_WilliamShakespeareHamlet_p949,"empresa, bajo las condiciones de recíproca seguridad expresadas aquí."
modified_WilliamShakespeareHamlet_p950,"Está bien, leeré en tiempo más oportuno sus proposiciones, y"
modified_WilliamShakespeareHamlet_p951,reflexionaré lo que debo en este caso responderle. Entretanto os doy gracias
modified_WilliamShakespeareHamlet_p952,por el feliz desempeño de vuestro encargo. Descansad. A la noche seréis
modified_WilliamShakespeareHamlet_p953,conmigo en el festín. Tendré gusto de veros.
modified_WilliamShakespeareHamlet_p954,Escena VI
modified_WilliamShakespeareHamlet_p955,"CLAUDIO, GERTRUDIS y POLONIO"
modified_WilliamShakespeareHamlet_p956,"Este asunto se ha concluido muy bien. Mi Soberano y vos,"
modified_WilliamShakespeareHamlet_p957,"señora, explicar lo que es la dignidad de un Monarca, las obligaciones del"
modified_WilliamShakespeareHamlet_p958,"vasallo y porque el día es día, noche la noche, y tiempo el tiempo; sería gastar"
modified_WilliamShakespeareHamlet_p959,"inútilmente el día, la noche y el tiempo. Así, pues, como quiera que la"
modified_WilliamShakespeareHamlet_p960,"brevedad es el alma del talento, y que nada hay más enfadoso que los rodeos"
modified_WilliamShakespeareHamlet_p961,"y perífrasis... Seré muy breve. Vuestro noble hijo está loco; y le llamo loco,"
modified_WilliamShakespeareHamlet_p962,"porque (si en rigor se examina) ¿qué otra cosa es la locura, sino estar uno"
modified_WilliamShakespeareHamlet_p963,"enteramente loco? Pero, dejando esto aparte..."
modified_WilliamShakespeareHamlet_p964,"Al caso, Polonio, al caso y menos artificios."
modified_WilliamShakespeareHamlet_p965,"Yo os prometo, señora, que no me valgo de artificio alguno."
modified_WilliamShakespeareHamlet_p966,Es cierto que él está loco. Es cierto que es lástima y es lástima que sea cierto;
modified_WilliamShakespeareHamlet_p967,"pero dejemos a un lado esta pueril antítesis, que no quiero usar de artificios."
modified_WilliamShakespeareHamlet_p968,"Convengamos, pues, en que está loco, y ahora falta descubrir la causa de este"
modified_WilliamShakespeareHamlet_p969,"efecto, o por mejor decir, la causa de este defecto, porque este efecto"
modified_WilliamShakespeareHamlet_p970,"defectuoso, nace de una causa, y así resta considerar lo restante. Yo tengo"
modified_WilliamShakespeareHamlet_p971,"una hija... La tengo mientras es mía, que en prueba de su respeto y sumisión..."
modified_WilliamShakespeareHamlet_p972,"Notad lo que os digo... Me ha entregado esta carta. Ahora, resumid los"
modified_WilliamShakespeareHamlet_p973,hechos y sacaréis la consecuencia. Al ídolo celestial de mi alma: a la sin par
modified_WilliamShakespeareHamlet_p974,"Ofelia... Esta es una alta frase... ¡Una falta de frase, sin par! Es una falta de"
modified_WilliamShakespeareHamlet_p975,"frase, pero, oíd lo demás. Estas letras, destinadas a que su blanco y hermoso"
modified_WilliamShakespeareHamlet_p976,pecho las guarde: éstas...
modified_WilliamShakespeareHamlet_p977,¿Y esa carta se la ha enviado Hamlet?
modified_WilliamShakespeareHamlet_p978,"Bueno, ¡por cierto! Esperad un poco, seré muy fiel."
modified_WilliamShakespeareHamlet_p979,Duda que son de fuego las
modified_WilliamShakespeareHamlet_p980,"estrellas,"
modified_WilliamShakespeareHamlet_p981,duda si al sol hoy movimiento
modified_WilliamShakespeareHamlet_p982,"falta,"
modified_WilliamShakespeareHamlet_p983,"duda lo cierto, admite lo dudoso;"
modified_WilliamShakespeareHamlet_p984,pero no dudes de mi amor las
modified_WilliamShakespeareHamlet_p985,ansias.
modified_WilliamShakespeareHamlet_p986,"Estos versos aumentan mi dolor, querida Ofelia; ni sé tampoco expresar"
modified_WilliamShakespeareHamlet_p987,mis penas con arte; pero cree que te amo en extremo posible. Adiós. Tuyo
modified_WilliamShakespeareHamlet_p988,"siempre, mi adorada niña, mientras esta máquina exista. Hamlet. Mi hija, en"
modified_WilliamShakespeareHamlet_p989,"fuerza de su obediencia, me ha hecho ver esta carta, y además me ha contado"
modified_WilliamShakespeareHamlet_p990,"las solicitudes del Príncipe; según han ocurrido, con todas las circunstancias"
modified_WilliamShakespeareHamlet_p991,"del tiempo, el lugar y el modo."
modified_WilliamShakespeareHamlet_p992,¿Y ella cómo ha recibido su amor?
modified_WilliamShakespeareHamlet_p993,¿En qué opinión me tenéis?
modified_WilliamShakespeareHamlet_p994,En la de un hombre honrado y veraz.
modified_WilliamShakespeareHamlet_p995,"Y me complazco en probaros que lo soy. Pero, ¿qué"
modified_WilliamShakespeareHamlet_p996,"hubierais pensado de mí, si cuando he visto que tomaba vuelo este ardiente"
modified_WilliamShakespeareHamlet_p997,"amor...? Porque os puedo asegurar que aun antes que mi hija me hablase, ya"
modified_WilliamShakespeareHamlet_p998,lo había yo advertido... ¿Qué hubiera pensado de mí vuestra Majestad y la
modified_WilliamShakespeareHamlet_p999,"Reina que está presente, si hubiera tolerado este galanteo? ¿Si, haciéndome"
modified_WilliamShakespeareHamlet_p1000,"violencia a mí propio, hubiera permanecido silencioso y mudo, mirándolo"
modified_WilliamShakespeareHamlet_p1001,"con indiferencia? ¿Qué hubierais pensado de mí? No, señor; yo he ido en"
modified_WilliamShakespeareHamlet_p1002,"derechura al asunto, y le dije a la niña ni más ni menos. Hija, el señor Hamlet"
modified_WilliamShakespeareHamlet_p1003,es un Príncipe muy superior a tu esfera... Esto no debe pasar adelante. Y
modified_WilliamShakespeareHamlet_p1004,"después, le mandé que se encerrase en su estancia sin admitir recados, ni"
modified_WilliamShakespeareHamlet_p1005,"recibir presentes. Ella ha sabido aprovecharse de mis preceptos, y el"
modified_WilliamShakespeareHamlet_p1006,"Príncipe... (para abreviar la historia) al verse desdeñado, comenzó a padecer"
modified_WilliamShakespeareHamlet_p1007,"melancolías, después inapetencia, después vigilias, después debilidad,"
modified_WilliamShakespeareHamlet_p1008,después aturdimiento y después (por una graduación natural) la locura que le
modified_WilliamShakespeareHamlet_p1009,"saca fuera de sí, y que todos nosotros lloramos."
modified_WilliamShakespeareHamlet_p1010,"¿Creéis, señora, que esto haya pasado así?"
modified_WilliamShakespeareHamlet_p1011,Me parece bastante probable.
modified_WilliamShakespeareHamlet_p1012,"¿Ha sucedido alguna vez..., tendría gusto de saberlo...? ¿Que"
modified_WilliamShakespeareHamlet_p1013,"yo haya dicho positivamente: esto hay, y que haya resultado lo contrario?"
modified_WilliamShakespeareHamlet_p1014,No se me acuerda.
modified_WilliamShakespeareHamlet_p1015,"Pues, separadme ésta de éste, si otra cosa hubiere en el"
modified_WilliamShakespeareHamlet_p1016,"asunto... ¡Ah! Por poco que las circunstancias me ayuden, yo descubriré la"
modified_WilliamShakespeareHamlet_p1017,verdad donde quiera que se oculte; aunque el centro de la tierra la sepultara.
modified_WilliamShakespeareHamlet_p1018,¿Y cómo te parece que pudiéramos hacer nuevas
modified_WilliamShakespeareHamlet_p1019,indagaciones?
modified_WilliamShakespeareHamlet_p1020,Bien sabéis que el Príncipe suele pasearse algunas veces por
modified_WilliamShakespeareHamlet_p1021,esa galería cuatro horas enteras.
modified_WilliamShakespeareHamlet_p1022,"Es verdad, así suele hacerlo."
modified_WilliamShakespeareHamlet_p1023,"Pues, cuando él venga, yo haré que mi hija le salga al paso."
modified_WilliamShakespeareHamlet_p1024,"Vos y yo nos ocultaremos detrás de los tapices, para observar lo que hace al"
modified_WilliamShakespeareHamlet_p1025,"verla. Si él no la ama y no es esta la causa de haber perdido el juicio,"
modified_WilliamShakespeareHamlet_p1026,despedidme de vuestro lado y de vuestra corte y enviadme a una alquería a
modified_WilliamShakespeareHamlet_p1027,guiar un arado.
modified_WilliamShakespeareHamlet_p1028,"Sí, yo lo quiero averiguar."
modified_WilliamShakespeareHamlet_p1029,"Pero, ¿veis? ¡Qué lástima! Leyendo viene el infeliz."
modified_WilliamShakespeareHamlet_p1030,"Retiraos, yo os lo suplico, retiraos entrambos, que le quiero"
modified_WilliamShakespeareHamlet_p1031,"hablar, si me dais licencia."
modified_WilliamShakespeareHamlet_p1032,Escena VII
modified_WilliamShakespeareHamlet_p1033,"POLONIO, HAMLET"
modified_WilliamShakespeareHamlet_p1034,"¡Cómo os va, mi buen señor!"
modified_WilliamShakespeareHamlet_p1035,"Bien, a Dios gracias."
modified_WilliamShakespeareHamlet_p1036,¿Me conocéis?
modified_WilliamShakespeareHamlet_p1037,Perfectamente. Tú vendes peces.
modified_WilliamShakespeareHamlet_p1038,¿Yo? No señor.
modified_WilliamShakespeareHamlet_p1039,Así fueras honrado.
modified_WilliamShakespeareHamlet_p1040,¿Honrado decís?
modified_WilliamShakespeareHamlet_p1041,"Sí, señor, que lo digo. El ser honrado según va el mundo, es"
modified_WilliamShakespeareHamlet_p1042,lo mismo que ser escogido uno entre diez mil.
modified_WilliamShakespeareHamlet_p1043,Todo eso es verdad.
modified_WilliamShakespeareHamlet_p1044,Si el sol engendra gusanos en un perro muerto y aunque es un
modified_WilliamShakespeareHamlet_p1045,"Dios, alumbra benigno con sus rayos a un cadáver corrupto... ¿No tienes una"
modified_WilliamShakespeareHamlet_p1046,hija?
modified_WilliamShakespeareHamlet_p1047,"Sí, señor, una tengo."
modified_WilliamShakespeareHamlet_p1048,Pues no la dejes pasear al sol. La concepción es una
modified_WilliamShakespeareHamlet_p1049,bendición del cielo; pero no del modo en que tu hija podrá concebir. Cuida
modified_WilliamShakespeareHamlet_p1050,"mucho de esto, amigo."
modified_WilliamShakespeareHamlet_p1051,¿Pero qué queréis decir con eso? Siempre está pensando en
modified_WilliamShakespeareHamlet_p1052,"mi hija. No obstante, al principio no me conoció... Dice que vendo peces..."
modified_WilliamShakespeareHamlet_p1053,"¡Está rematado, rematado!... Y en verdad que yo también, siendo mozo, me"
modified_WilliamShakespeareHamlet_p1054,vi muy trastornado por el amor... Casi tanto como él. Quiero hablarle otra
modified_WilliamShakespeareHamlet_p1055,vez. ¿Qué estáis leyendo?
modified_WilliamShakespeareHamlet_p1056,"Palabras, palabras, todo palabras."
modified_WilliamShakespeareHamlet_p1057,¿Y de qué se trata?
modified_WilliamShakespeareHamlet_p1058,¿Entre quién?
modified_WilliamShakespeareHamlet_p1059,"Digo, que ¿de qué trata el libro que leéis?"
modified_WilliamShakespeareHamlet_p1060,"De calumnias. Aquí dice el malvado satírico, que los viejos"
modified_WilliamShakespeareHamlet_p1061,"tienen la barba blanca, las caras con arrugas, que vierten de sus ojos ámbar"
modified_WilliamShakespeareHamlet_p1062,"abundante y goma de ciruela; que padecen gran debilidad de piernas, y"
modified_WilliamShakespeareHamlet_p1063,"mucha falta de entendimiento. Todo lo cual, señor mío, aunque yo plena y"
modified_WilliamShakespeareHamlet_p1064,"eficazmente lo creo; con todo eso, no me parece bien hallarlo afirmado en"
modified_WilliamShakespeareHamlet_p1065,"tales términos, porque al fin, vos seríais sin duda tan joven como yo, si os"
modified_WilliamShakespeareHamlet_p1066,fuera posible andar hacia atrás como el cangrejo.
modified_WilliamShakespeareHamlet_p1067,"Aunque todo es locura, no deja de observar método en lo que"
modified_WilliamShakespeareHamlet_p1068,"dice. ¿Queréis venir, señor, adonde no os dé el aire?"
modified_WilliamShakespeareHamlet_p1069,¿Adónde? ¿A la sepultura?
modified_WilliamShakespeareHamlet_p1070,"Cierto, que allí no da el aire. ¡Con qué agudeza responde"
modified_WilliamShakespeareHamlet_p1071,"siempre! Estos golpes felices son frecuentes en la locura, cuando en el estado"
modified_WilliamShakespeareHamlet_p1072,"de razón y salud, tal vez no se logran. Voyle a dejar y disponer al instante el"
modified_WilliamShakespeareHamlet_p1073,"careo entre él, y mi hija. Señor, si me dais licencia de que me vaya..."
modified_WilliamShakespeareHamlet_p1074,No me puedes pedir cosa que con más gusto te conceda;
modified_WilliamShakespeareHamlet_p1075,"exceptuando la vida, eso sí, exceptuando la vida."
modified_WilliamShakespeareHamlet_p1076,"Adiós, señor."
modified_WilliamShakespeareHamlet_p1077,¡Fastidiosos y extravagantes viejos!
modified_WilliamShakespeareHamlet_p1078,"Si buscáis al príncipe, vedle ahí."
modified_WilliamShakespeareHamlet_p1079,Escena VIII
modified_WilliamShakespeareHamlet_p1080,"HAMLET, RICARDO, GUILLERMO"
modified_WilliamShakespeareHamlet_p1081,"Buenos días, señor."
modified_WilliamShakespeareHamlet_p1082,Dios guarde a vuestra Alteza.
modified_WilliamShakespeareHamlet_p1083,Mi venerado Príncipe.
